{
  "schema_version": "eso.asset_universe.v1",
  "name": "alt_funding_template",
  "defaults": {
    "feature_mode": "alt_funding",
    "close_col": "close",
    "timestamp_col": "timestamp",
    "horizons": [3, 12],
    "train_fraction": 0.7,
    "phase_window": 24,
    "reference_path": "data/BTCUSDT_4h.csv",
    "relative_windows": [12, 42],
    "reference_tolerance": "4h"
  },
  "assets": [
    {
      "asset_id": "ALTUSDT_4h",
      "path": "data/ALTUSDT_4h.csv"
    }
  ]
}
